{
  "$schema": "http://json-schema.org/draft-04/schema#",
  "type": "object",
  "properties": {
    "license": {
      "type": "string"
    },
    "npi": {
      "type": "string"
    },
    "dcn": {
      "type": "string"
    },
    "entity_name": {
        "type": "string"
    },
    "practitioner_name": {
      "type": "string"
    },
    "action_initial": {
      "type": "string"
    },
    "action_basis": {
      "type": "string"
    },
    "event_outcome": {
    "type": "string"
    },
    "process_date": {
    "type": "string"
    },
    "payment_date": {
    "type": "string"
    },
    "event_day": {
    "type": "string"
    },
    "amount_pract": {
    "type": "string"
    },
    "payment_total_amount": {
    "type": "string"
    }
  },
  "required": [
    "license",
    "npi",
    "dcn",
    "entity_name",
    "practitioner_name",
    "action_initial",
    "action_basis",
    "event_outcome",
    "process_date",
    "payment_date",
    "event_day",
    "amount_pract",
    "payment_total_amount"
  ]
} 


