[
  {
    "license": "'217720, NY'",
    "npi": "1720069438",
    "dcn": "5500000131130824",
    "entity_name": "'PHYSICIANS RECIPROCAL INSURERS'",
    "practitioner_name": "'ALASTRA, ANTHONY'",
    "action_initial": "'SETTLEMENT'",
    "action_basis": "'IMPROPER PERFORMANCE'",
    "event_outcome": "'SIGNIFIGANT PERMANENT INJURY (06)'",
    "process_date": "01/24/2018",
    "payment_date": "01/16/2018",
    "event_day": "02/09/2011",
    "amount_pract": "1000000",
    "payment_total_amount": "1000000"
  },
  {
    "license": "'217720, NY'",
    "npi": "1720069438",
    "dcn": "5500000111410130",
    "entity_name": "'PHYSICIANS RECIPROCAL INSURERS'",
    "practitioner_name": "'ALASTRA, ANTHONY'",
    "action_initial": "'SETTLEMENT'",
    "action_basis": "'FAILURE TO DIAGNOSE'",
    "event_outcome": "'SIGNIFIGANT PERMANENT INJURY (06)'",
    "process_date": "08/24/2016",
    "payment_date": "8/24/2016",
    "event_day": "11/30/2011",
    "amount_pract": "75000",
    "payment_total_amount": "75000"
  },
  {
    "license": "'217720, NY'",
    "npi": "1720069438",
    "dcn": "5500000093021355",
    "entity_name": "'APPLIED MEDICO-LEGAL SILUTIONS RRG'",
    "practitioner_name": "'ALASTRA, ANTHONY'",
    "action_initial": "'SETTLEMENT'",
    "action_basis": "'IMPROPER PERFORMANCE'",
    "event_outcome": "'MINOR TEMPORARY INJURY (03)'",
    "process_date": "11/06/2014",
    "payment_date": "9/29/2014",
    "event_day": "03/04/2009",
    "amount_pract": "175000",
    "payment_total_amount": "175000"
  },
  {
    "license": "'217720, NY'",
    "npi": "1720069438",
    "dcn": "5500000085019114",
    "entity_name": "'PHYSICIANS RECIPROCAL INSURERS'",
    "practitioner_name": "'ALASTRA, ANTHONY'",
    "action_initial": "'SETTLEMENT'",
    "action_basis": "'FAILURE TO RECOGNIZE A COMPLICATION','FAILURE TO TREAT'",
    "event_outcome": "'DEATH (09)'",
    "process_date": "10/09/2013",
    "payment_date": "09/05/2013",
    "event_day": "05/09/2008",
    "amount_pract": "950000",
    "payment_total_amount": "950000"
  },
  {
    "license": "'217720, NY'",
    "npi": "1720069438",
    "dcn": "5500000076340126",
    "entity_name": "'PHYSICIANS RECIPROCAL INSURERS'",
    "practitioner_name": "'ALASTRA, ANTHONY'",
    "action_initial": "'SETTLEMENT'",
    "action_basis": "'FAILURE TO ORDER APPROPRIATE TEST'",
    "event_outcome": "'SIGNIFIGANT PERMANENT INJURY (06)'",
    "process_date": "07/25/2012",
    "payment_date": "07/23/2012",
    "event_day": "12/19/2005",
    "amount_pract": "750000",
    "payment_total_amount": "750000"
  },
  {
    "license": "'217720, NY'",
    "npi": "1720069438",
    "dcn": "5500000070612211",
    "entity_name": "'PHYSICIANS RECIPROCAL INSURERS'",
    "practitioner_name": "'ALASTRA, ANTHONY'",
    "action_initial": "'SETTLEMENT'",
    "action_basis": "'FAILURE TO RECOGNIZE A COMPLICATION'",
    "event_outcome": "'DEATH (09)'",
    "process_date": "09/14/2011",
    "payment_date": "08/01/2011",
    "event_day": "03/20/2006",
    "amount_pract": "500000",
    "payment_total_amount": "500000"
  }
]
