[
    {
        "license": "321149, UT', 'MD60230696, WA'", 
        "npi": "'1104987916'", 
        "dcn": "'5500000153184263'",
        "entity_name": "'UMIA INSURANCE INC'",
        "practitioner_name": "'KAMALU,'",
        "action_initial": "'SETTLEMENT'",
        "action_basis": "'FAILURE TO TEST EQUIPMENT'",
        "event_outcome": "' MINOR TEMPORARY INJURY (03)'",
        "process_date": "'10/29/2015'",
        "payment_date": "'10/21/2015'",
        "event_day": "'01/06/2008'",
        "amount_pract": "'5000'",
        "payment_total_amount": "'5000'"
    }, 
    {
        "license": "321149, UT', 'MD60230696, WA'", 
        "npi": "'1104987916'", 
        "dcn": "'5500000101038064'",
        "entity_name": "'UTAH MEDICAL INSURANCE ASSN', 'UMIA INSURANCE INC'",
        "practitioner_name": "'KAMALU, LAYNE K'",
        "action_initial": "'SETTLEMENT'",
        "action_basis": "'FAILURE TO ORDER APPROPRIATE TEST'", 
        "event_outcome": "' MINOR PERMANENT INJURY (05)'",
        "process_date": "'06/06/2007'",
        "payment_date": "'06/05/2007'",
        "event_day": "'05/19/2005'",
        "amount_pract": "'40000'",
        "payment_total_amount": "'212500'"
        }
    ]
    